{
  "updated_at": "2026-10-19T13:11:51.456822+00:00",
  "published": true,
  "publish_blocked_reasons": [],
  "sources": [
    {
      "url": "https://raw.githubusercontent.com/ALIILAPRO/MTProtoProxy/main/mtproto.txt",
      "ok": true,
      "bytes": 20678,
      "links_found": 218,
      "links_accepted": 212,
      "endpoints_new": 212,
      "duplicate_endpoints": 0,
      "error": null
    },
    {
      "url": "https://raw.githubusercontent.com/Argh94/Proxy-List/main/MTProto.txt",
      "ok": true,
      "bytes": 23294,
      "links_found": 257,
      "links_accepted": 251,
      "endpoints_new": 56,
      "duplicate_endpoints": 195,
      "error": null
    }
  ],
  "metadata_sources": [],
  "source_history": {
    "https://raw.githubusercontent.com/ALIILAPRO/MTProtoProxy/main/mtproto.txt": {
      "kind": "list",
      "runs": 49,
      "last_run": "2026-10-19T13:11:51.456822+00:00",
      "last_ok": "2026-10-19T13:11:51.456822+00:00",
      "last_error": null,
      "last_links_found": 218,
      "last_links_accepted": 212,
      "last_new_endpoints": 212,
      "total_new_endpoints": 8583,
      "total_links_accepted": 8633,
      "ok_runs": 49
    },
    "https://raw.githubusercontent.com/Argh94/Proxy-List/main/MTProto.txt": {
      "kind": "list",
      "runs": 49,
      "last_run": "2026-10-19T13:11:51.456822+00:00",
      "last_ok": "2026-10-19T13:11:51.456822+00:00",
      "last_error": null,
      "last_links_found": 257,
      "last_links_accepted": 251,
      "last_new_endpoints": 56,
      "total_new_endpoints": 2987,
      "total_links_accepted": 9906,
      "ok_runs": 49
    }
  },
  "sources_ok": 2,
  "sources_total": 2,
  "discovered": 268,
  "duplicate_endpoints_removed": 1,
  "checked_candidates": 268,
  "skipped_by_cap": 0,
  "mtproto_verified": 246,
  "stable_in_window": 261,
  "best_published": 20,
  "blocked_non_public": 3,
  "block_reasons": {
    "dns_no_addresses": 3
  },
  "rejected_links": {
    "bad_secret": 12
  },
  "average_rtt_ms": 539.24,
  "average_check_ms": 774.84,
  "median_rtt_ms": 499.86,
  "dns_cache": {
    "hosts": 386,
    "hits": 0,
    "misses": 242,
    "ttl_hours": 6.0
  },
  "engines": [
    "library"
  ],
  "check": "real MTProto relay health check",
  "verification": [
    "TCP connect",
    "MTProxy obfuscated2 handshake",
    "MTProto req_pq_multi",
    "valid Telegram resPQ response"
  ],
  "policy": {
    "min_discovered": 10,
    "min_keep_ratio": 0.25,
    "max_candidates": 400,
    "known_good_hours": 6.0,
    "stable_ttl_hours": 24.0,
    "best_count": 20,
    "rtt_history": 10,
    "dns_cache_hours": 6.0,
    "dcs": [],
    "guard_dns": true,
    "engine": "auto"
  },
  "note": "working.txt = verified in this run; stable.txt = verified within 24h, best first; best.txt = top 20 by stability; a green check only means the MTProto handshake to Telegram succeeded."
}
